{
  "chapter_id": "agent-controller-bridge",
  "title": "Agent ↔ Controller Bridge",
  "path": "/docs/ros2/agent-controller-bridge",
  "chunk_ids": ["bridge-001", "bridge-002", "bridge-003", "bridge-004"],
  "related_chapters": ["rclpy-agents", "urdf-humanoids"],
  "word_count": 1300,
  "token_count": 1040,
  "last_indexed": "2025-12-16T12:00:00Z"
}